北京,海淀区,北京一零一中学
内蒙古,呼和浩特,呼和浩特市黄河民族中学
内蒙古,呼和浩特,呼和浩特市三十一中学
内蒙古,呼和浩特,内大职院高考补习班
内蒙古,呼和浩特,清水河县窑沟乡中学
内蒙古,呼和浩特,呼市第六中学
内蒙古,呼和浩特,托县第一中学
内蒙古,呼和浩特,内蒙古化工职业学校附属乌兰中学
内蒙古,呼和浩特,呼市创新中学
内蒙古,呼和浩特,清水河县北堡乡中学
内蒙古,呼和浩特,托克托县新营子镇中学
内蒙古,呼和浩特,呼市新世纪高考补习班
内蒙古,呼和浩特,内蒙古电力学校
内蒙古,呼和浩特,呼和浩特市新世纪高考复习学校
内蒙古,呼和浩特,和林县新店子中学
内蒙古,呼和浩特,武川县大青山乡中学
内蒙古,呼和浩特,和林县职业高级中学
内蒙古,呼和浩特,和林县民族中学
内蒙古,呼和浩特,呼和浩特铁路局呼和浩特职工子弟第五中学
内蒙古,呼和浩特,呼和浩特市第三十中学
内蒙古,呼和浩特,呼市政协希文中学
内蒙古,呼和浩特,和林县董家乡中学
内蒙古,呼和浩特,土默特左旗三两乡三两中学
内蒙古,呼和浩特,清水河县暖泉乡中学
内蒙古,呼和浩特,土默特左旗白庙子乡中学
内蒙古,呼和浩特,呼和浩特市第九中学
内蒙古,呼和浩特,清水河县单台子乡中学
内蒙古,呼和浩特,托克托县永圣域乡中学
内蒙古,呼和浩特,托克托县育才中学
内蒙古,呼和浩特,武川县教师进修学校
内蒙古,呼和浩特,托克托县新营子镇黑城中学
内蒙古,呼和浩特,呼和浩特市佳联学校
内蒙古,呼和浩特,土左旗第三中学
内蒙古,呼和浩特,呼和浩特铁路局呼和浩特职工子弟第二中学
内蒙古,呼和浩特,和林县巧什营中学
内蒙古,呼和浩特,土默特左旗第二中学
内蒙古,呼和浩特,武川县武英中学
内蒙古,呼和浩特,土左旗同光学校
内蒙古,呼和浩特,清水河县王桂窑乡中学
内蒙古,呼和浩特,武川县第二中学
内蒙古,呼和浩特,土默特左旗沙尔营乡中学
内蒙古,呼和浩特,托县第二中学
内蒙古,呼和浩特,土默特左旗风华学校
内蒙古,呼和浩特,土默特左旗大岱乡中学
内蒙古,呼和浩特,土默特左旗益民中学
内蒙古,呼和浩特,呼市玉泉区育林中学
内蒙古,呼和浩特,清水河县高级中学
内蒙古,呼和浩特,武川县厂汉木台乡中学
内蒙古,呼和浩特,武川县哈乐乡中学
内蒙古,呼和浩特,呼市玉泉区第三十二中
内蒙古,呼和浩特,土默特左旗宇星中学
内蒙古,呼和浩特,呼和浩特市奇志中学
内蒙古,呼和浩特,托县育才中学
内蒙古,呼和浩特,武川县可镇安字号中学
内蒙古,呼和浩特,土默特左旗育才学校
内蒙古,呼和浩特,土默特左旗才茂学校
内蒙古,呼和浩特,呼和浩特市新世纪高级实验中学
内蒙古,呼和浩特,和林县第二中学
内蒙古,呼和浩特,托克托县五申镇中学
内蒙古,呼和浩特,和林县羊群沟中学
内蒙古,呼和浩特,清水河县第二中学
内蒙古,呼和浩特,呼和浩特市华西中学
内蒙古,呼和浩特,呼和浩特市奋发中学
内蒙古,呼和浩特,呼和浩特市德安中学
内蒙古,呼和浩特,武川县西乌兰不浪中学
内蒙古,呼和浩特,呼和浩特市民族育红学校
内蒙古,呼和浩特,土左旗三立学校
内蒙古,呼和浩特,托克托县乃只盖中学
内蒙古,呼和浩特,和林县樊家夭中学
内蒙古,呼和浩特,和林县黑老夭中学
内蒙古,呼和浩特,和林格尔县公喇嘛中学
内蒙古,呼和浩特,和林县舍必崖中学
内蒙古,呼和浩特,和林县西沟门中学
内蒙古,呼和浩特,新世纪高级试验中学
内蒙古,阿拉善盟,阿左旗高级中学
内蒙古,阿拉善盟,额济纳旗中学
内蒙古,阿拉善盟,阿拉善右旗第一中学
内蒙古,阿拉善盟,阿左旗一中
内蒙古,阿拉善盟,阿拉善盟教育体育局教研室
内蒙古,阿拉善盟,阿拉善盟民族中学
内蒙古,阿拉善盟,阿拉善左旗第八中学
内蒙古,阿拉善盟,内蒙古自治区阿盟一中
内蒙古,阿拉善盟,阿左旗第四中学
内蒙古,阿拉善盟,阿盟民中
内蒙古,阿拉善盟,阿左旗盐中
内蒙古,阿拉善盟,阿拉善左旗第九中学
内蒙古,阿拉善盟,阿左旗第三中学
内蒙古,阿拉善盟,阿拉善盟吉兰太盐场职工子弟中学
内蒙古,阿拉善盟,额济纳旗民族中学
内蒙古,阿拉善盟,阿左旗第五中学
内蒙古,阿拉善盟,阿拉善左旗第六中学
内蒙古,阿拉善盟,阿左旗巴润别立镇中学
内蒙古,兴安盟,乌兰浩特市第四中学
内蒙古,兴安盟,科右前旗二中
内蒙古,兴安盟,伍塔其监狱管理局第二中学
内蒙古,兴安盟,科右前旗一中
内蒙古,兴安盟,乌兰浩特市第十五中学
内蒙古,兴安盟,乌兰浩特第二中学
内蒙古,兴安盟,乌兰浩特第一中学
内蒙古,兴安盟,兴安盟红城高中
内蒙古,兴安盟,音德尔第一中学
内蒙古,兴安盟,乌兰浩特市一中
内蒙古,兴安盟,乌兰浩特市兴安高中
内蒙古,兴安盟,乌兰浩特市二中
内蒙古,兴安盟,乌兰浩特市第六中学
内蒙古,兴安盟,扎赉特旗音德尔第五中学
内蒙古,兴安盟,突泉县第一中学
内蒙古,兴安盟,乌兰浩特市十三中
内蒙古,兴安盟,科右前旗树木沟乡中学
内蒙古,兴安盟,乌兰浩特朝鲜族中学
内蒙古,兴安盟,兴安实验高级中学
内蒙古,兴安盟,巴彦呼舒第三中学
内蒙古,兴安盟,巴彦呼舒第一中学
内蒙古,兴安盟,科右前旗大坝沟镇中学
内蒙古,兴安盟,科右中旗第五中学
内蒙古,兴安盟,阿尔山市伊尔施中学
内蒙古,兴安盟,扎赉特旗音德尔第四中学
内蒙古,兴安盟,科右前旗第二中学
内蒙古,兴安盟,科右中旗第三中学
内蒙古,兴安盟,科右前旗额尔格图镇中学
内蒙古,兴安盟,扎赉特旗图牧吉镇蓝天希望中学
内蒙古,兴安盟,扎赉特旗音德尔第一中学
内蒙古,兴安盟,科右前旗索伦镇中学
内蒙古,兴安盟,扎赉特旗好力保中学
内蒙古,兴安盟,科右前旗第一中学
内蒙古,兴安盟,科右前旗哈拉黑镇中学
内蒙古,兴安盟,科右前旗大石寨中学
内蒙古,兴安盟,科右前旗归流河镇第一中学
内蒙古,兴安盟,兴安盟农场局直属中学
内蒙古,兴安盟,科右前旗察尔森镇中学
内蒙古,兴安盟,音德尔第二中学
内蒙古,兴安盟,扎赉特旗音德尔第六中学
内蒙古,兴安盟,科右前旗阿力得尔乡中学
内蒙古,兴安盟,扎赉特旗音德尔第三中学
内蒙古,兴安盟,扎赉特旗音德尔第二中学
内蒙古,兴安盟,扎赉特旗阿拉达尔吐中学
内蒙古,兴安盟,扎赉特旗宝力根花中学
内蒙古,兴安盟,科右中旗第二中学
内蒙古,兴安盟,科右前旗俄体镇第二中学
内蒙古,兴安盟,兴安盟杜尔基农场学校
内蒙古,兴安盟,科右前旗大石寨蒙中
内蒙古,兴安盟,科右中旗高力板镇义和道卜中学
内蒙古,兴安盟,科右前旗卫东镇中学
内蒙古,兴安盟,扎赉特旗五家户中学
内蒙古,兴安盟,巴仁哲里木镇中学
内蒙古,兴安盟,突泉县高级中学
内蒙古,兴安盟,科右前旗巴拉格歹乡中学
内蒙古,兴安盟,科右前旗白辛中学
内蒙古,兴安盟,乌兰浩特市惠杰中学
内蒙古,兴安盟,扎赉特旗二龙山乡中学
内蒙古,兴安盟,科右前旗古迹乡中学
内蒙古,兴安盟,突泉县六户中学
内蒙古,兴安盟,科右前旗俄体镇第一中学
内蒙古,兴安盟,市五一中学
内蒙古,兴安盟,科右前旗保门中学
内蒙古,兴安盟,扎赉特旗小城子乡中学
内蒙古,兴安盟,科右中旗第四中学
内蒙古,兴安盟,扎赉特旗绰勒镇中学
内蒙古,兴安盟,科右中旗第一中学
内蒙古,兴安盟,科右前旗乌兰毛都乡中学
内蒙古,兴安盟,扎赉特旗巴彦扎拉嘎中学
内蒙古,兴安盟,科右中旗巴彦茫哈苏木中学
内蒙古,兴安盟,科右前旗好仁中学
内蒙古,兴安盟,扎赉特旗绰勒镇阿拉坦花中学
内蒙古,兴安盟,扎赉特旗罕达罕中学
内蒙古,兴安盟,科右前旗葛根庙镇中学
内蒙古,兴安盟,扎赉特旗胡尔勒镇中学
内蒙古,兴安盟,科右中旗高力板镇巴仁太本中学
内蒙古,兴安盟,科右前旗归流河镇第二中学
内蒙古,兴安盟,扎赉特旗阿尔本格勒镇中学
内蒙古,兴安盟,扎赉特旗巴彦乌兰苏木中学
内蒙古,兴安盟,突泉县太和乡中学
内蒙古,兴安盟,扎赉特旗新林镇中学
内蒙古,兴安盟,扎赉特旗巴彦高勒镇中学
内蒙古,兴安盟,扎赉特旗努文木仁中学
内蒙古,兴安盟,科右中旗新佳木中学
内蒙古,兴安盟,科右前旗勿布林乡中学
内蒙古,兴安盟,科右中旗杜尔基中学
内蒙古,兴安盟,内蒙古突泉县宝石镇中学
内蒙古,兴安盟,扎赉特旗巴岱乡中学
内蒙古,兴安盟,突泉县学田乡中学
内蒙古,兴安盟,科右中旗好腰苏木中学
内蒙古,兴安盟,科右中旗高力板镇中学
内蒙古,兴安盟,科右中旗西尔根中学
内蒙古,兴安盟,科右中旗布敦化中学
内蒙古,兴安盟,科右中旗代钦塔拉苏木中学
内蒙古,兴安盟,科右中旗吐列毛杜镇中学
内蒙古,兴安盟,扎赉特旗巴达尔胡中学
内蒙古,兴安盟,突泉县水泉镇水泉中学
内蒙古,兴安盟,科右中旗坤都冷中学
内蒙古,兴安盟,科右中旗巴扎拉嘎中学
内蒙古,兴安盟,突泉县溪柳乡中学
内蒙古,兴安盟,科右中旗巴彦淖尔苏木中学
内蒙古,兴安盟,突泉县太平中学
内蒙古,兴安盟,阿尔山森工公司第一中学
内蒙古,兴安盟,科右中旗额木庭高勒中学
内蒙古,兴安盟,五岔沟林场中学
内蒙古,兴安盟,突泉县太东乡中学
内蒙古,兴安盟,突泉县九龙中学
内蒙古,锡林郭勒盟,太仆寺旗宝昌一中
内蒙古,锡林郭勒盟,锡林浩特市蒙古中学
内蒙古,锡林郭勒盟,多伦三中
内蒙古,锡林郭勒盟,锡林浩特市第六中学
内蒙古,锡林郭勒盟,锡盟职教中心
内蒙古,锡林郭勒盟,正镶白旗蒙古族中学
内蒙古,锡林郭勒盟,锡林郭勒盟乌拉盖管理区中学
内蒙古,锡林郭勒盟,锡林浩特市一中
内蒙古,锡林郭勒盟,二连浩特国际语言学校
内蒙古,锡林郭勒盟,锡林郭勒盟蒙古中学
内蒙古,锡林郭勒盟,太仆寺旗骆驼山乡中学
内蒙古,锡林郭勒盟,太仆寺旗永丰镇永丰中学
内蒙古,锡林郭勒盟,正镶白旗蒙古中学
内蒙古,锡林郭勒盟,锡林浩特新时代高级中学
内蒙古,锡林郭勒盟,苏尼特右旗综合高中
内蒙古,锡林郭勒盟,正蓝旗蒙古族中学
内蒙古,锡林郭勒盟,太仆寺旗蒙古族中学
内蒙古,锡林郭勒盟,锡林郭勒盟第二中学
内蒙古,锡林郭勒盟,太仆寺旗红旗乡中学
内蒙古,锡林郭勒盟,锡林郭勒盟二中
内蒙古,锡林郭勒盟,太仆寺旗永丰镇马坊子中学
内蒙古,锡林郭勒盟,太仆寺旗幸福乡东井子中学
内蒙古,锡林郭勒盟,呼和浩特铁路局二连浩特职工子弟中学
内蒙古,锡林郭勒盟,镶黄旗第一中学
内蒙古,锡林郭勒盟,太仆寺旗幸福乡中学
内蒙古,锡林郭勒盟,锡林郭勒盟农管局民族中学
内蒙古,锡林郭勒盟,二连浩特市蒙古族学校
内蒙古,锡林郭勒盟,太仆寺旗宝昌第二中学
内蒙古,锡林郭勒盟,正镶白旗学堂地乡中学
内蒙古,锡林郭勒盟,太仆寺旗中河中学
内蒙古,锡林郭勒盟,多伦县十五号学区
内蒙古,锡林郭勒盟,正蓝旗直属中学
内蒙古,锡林郭勒盟,锡林浩特市新时代高级中学
内蒙古,锡林郭勒盟,多伦县第三中学
内蒙古,锡林郭勒盟,二连浩特市中学
内蒙古,锡林郭勒盟,多伦县第一中学
内蒙古,锡林郭勒盟,多伦县蔡木山乡学区
内蒙古,锡林郭勒盟,太仆寺旗五面井乡红山子中学
内蒙古,锡林郭勒盟,阿巴嘎旗蒙古中学
内蒙古,锡林郭勒盟,苏尼特左旗综合高级中学
内蒙古,锡林郭勒盟,正蓝旗第二中学
内蒙古,锡林郭勒盟,正镶白旗星耀中学
内蒙古,锡林郭勒盟,正镶白旗查干淖尔中学
内蒙古,锡林郭勒盟,多伦县第二中学
内蒙古,锡林郭勒盟,锡盟乌拉盖开发区中学
内蒙古,锡林郭勒盟,正蓝旗桑根达来中学
内蒙古,锡林郭勒盟,多伦县黑山咀三道沟学校
内蒙古,锡林郭勒盟,太仆寺旗头支箭镇万寿滩中学
内蒙古,锡林郭勒盟,太仆寺旗五面井乡中学
内蒙古,锡林郭勒盟,太仆寺旗千斤沟镇中学
内蒙古,锡林郭勒盟,多伦县上都河乡学区
内蒙古,锡林郭勒盟,东乌珠穆沁旗蒙古族中学
内蒙古,锡林郭勒盟,多伦县大河口学区
内蒙古,锡林郭勒盟,多伦县西干沟乡学区
内蒙古,锡林郭勒盟,东乌珠穆沁旗第二中学
内蒙古,锡林郭勒盟,西乌珠穆沁旗蒙古中学
内蒙古,锡林郭勒盟,正蓝旗上都音高勒镇中学
内蒙古,锡林郭勒盟,太仆寺旗沙沟乡中学
内蒙古,锡林郭勒盟,镶黄旗第二蒙古中学
内蒙古,锡林郭勒盟,多伦县淖尔镇学区
内蒙古,锡林郭勒盟,太仆寺旗头支箭镇中学
内蒙古,锡林郭勒盟,苏尼特右旗查化中学
内蒙古,锡林郭勒盟,西乌珠穆沁旗第二蒙古中学
内蒙古,锡林郭勒盟,多伦县黑山咀镇学区
内蒙古,锡林郭勒盟,苏尼特右旗第三中学
内蒙古,锡林郭勒盟,正蓝旗哈毕日嘎中学
内蒙古,锡林郭勒盟,多伦县大北镇学区
内蒙古,锡林郭勒盟,正蓝旗乌日图塔拉中学
内蒙古,锡林郭勒盟,西乌珠穆沁旗第一中学
内蒙古,锡林郭勒盟,西乌珠穆沁旗第二中学
内蒙古,乌兰察布,集宁一中
内蒙古,乌兰察布,内蒙古集宁一中
内蒙古,乌兰察布,旗下营中学
内蒙古,乌兰察布,内蒙古集宁新世纪中学
内蒙古,乌兰察布,卓资中学
内蒙古,乌兰察布,乌兰察布市蒙古族中学
内蒙古,乌兰察布,内蒙古乌兰察布市察右中旗第一中学
内蒙古,乌兰察布,内蒙古乌兰察布市丰镇市第一中学
内蒙古,乌兰察布,乌兰察布市育英高级中学
内蒙古,乌兰察布,集宁区第二中学
内蒙古,乌兰察布,集宁师范高等专科学校附属中学
内蒙古,乌兰察布,丰镇市第一中学
内蒙古,乌兰察布,集宁市第八中学
内蒙古,乌兰察布,集宁市第五中学
内蒙古,乌兰察布,兴和县第一中学
内蒙古,乌兰察布,集宁区第十一中学
内蒙古,乌兰察布,集宁区第四中学
内蒙古,乌兰察布,商都县高级中学
内蒙古,乌兰察布,内蒙古凉城县第一中学
内蒙古,乌兰察布,内蒙古凉城县老村中学
内蒙古,乌兰察布,丰镇市新城湾中学
内蒙古,乌兰察布,集宁师范高等专科学校附属实验中学
内蒙古,乌兰察布,四子王旗第一中学
内蒙古,乌兰察布,丰镇市第四中学
内蒙古,乌兰察布,察右前旗高宏店学区高宏店中心校
内蒙古,乌兰察布,集宁区十三中
内蒙古,乌兰察布,四子王旗一中
内蒙古,乌兰察布,集宁市第四中学
内蒙古,乌兰察布,内蒙古乌兰察布市化德县长顺镇第二中学
内蒙古,乌兰察布,集宁区第十二中学
内蒙古,乌兰察布,察右前旗蒙古族中学
内蒙古,乌兰察布,丰镇市第二中学
内蒙古,乌兰察布,察哈尔右翼前旗第一中学
内蒙古,乌兰察布,凉城县双古城中学
内蒙古,乌兰察布,四子王旗大井坡中学
内蒙古,乌兰察布,元山子中学
内蒙古,乌兰察布,集宁市第九中学
内蒙古,乌兰察布,乌盟蒙古族中学
内蒙古,乌兰察布,丰镇市隆庄中学
内蒙古,乌兰察布,集宁市第七中学
内蒙古,乌兰察布,乌兰察布集宁龙兴中学
内蒙古,乌兰察布,察右前旗第一中学
内蒙古,乌兰察布,凉城第四中学
内蒙古,乌兰察布,呼和浩特铁路局集宁职工子弟第一中学
内蒙古,乌兰察布,察右后旗第一中学
内蒙古,乌兰察布,内蒙古化德县公腊胡洞中学
内蒙古,乌兰察布,内蒙古化德县白音特拉乡中学
内蒙古,乌兰察布,乌盟旗下营中学
内蒙古,乌兰察布,内蒙古化德县第二中学
内蒙古,乌兰察布,丰镇市巨宝庄中学
内蒙古,乌兰察布,察右后旗第二中学
内蒙古,乌兰察布,商都县玻璃忽镜乡中学
内蒙古,乌兰察布,内蒙古化德县朝阳镇土城子乡学区
内蒙古,乌兰察布,察右前旗平地泉中心校
内蒙古,乌兰察布,凉城县第二中学
内蒙古,乌兰察布,察右前旗玫瑰营中学
内蒙古,乌兰察布,内蒙古察右中旗第三中学
内蒙古,乌兰察布,内蒙古察右中旗第一中学
内蒙古,乌兰察布,内蒙古察右中旗第二中学
内蒙古,乌兰察布,兴和县第二中学
内蒙古,乌兰察布,内蒙古化德县第三中学
内蒙古,乌兰察布,丰镇市红砂坝镇红砂坝中学
内蒙古,乌兰察布,凉城县第三中学
内蒙古,乌兰察布,内蒙乌兰察布丰镇发电厂子弟中学
内蒙古,乌兰察布,凉城县天城乡中学
内蒙古,乌兰察布,兴和县张皋镇中学
内蒙古,乌兰察布,丰镇市官屯堡中学
内蒙古,乌兰察布,察右前旗新风中学
内蒙古,乌兰察布,凉城县第一中学
内蒙古,乌兰察布,集宁市十中
内蒙古,乌兰察布,丰镇市三义泉中学
内蒙古,乌兰察布,内蒙古集宁市工业区中学
内蒙古,乌兰察布,商都县大拉子乡中学
内蒙古,乌兰察布,兴和县五一乡中学
内蒙古,乌兰察布,内蒙古化德县第一中学
内蒙古,乌兰察布,马家00中学
内蒙古,乌兰察布,内蒙古化德县朝阳镇中学
内蒙古,乌兰察布,内蒙古化德县六支箭中学
内蒙古,乌兰察布,化德县白土卜子乡中学
内蒙古,乌兰察布,商都县三面井乡中学
内蒙古,乌兰察布,内蒙古察右中旗蒙古族中学
内蒙古,乌兰察布,察右前旗煤窑中学
内蒙古,乌兰察布,商都县大黑沙土镇四台坊子中学
内蒙古,乌兰察布,兴和县钦宝营中学
内蒙古,乌兰察布,呼和浩特铁路局集宁职工子弟第二中学
内蒙古,乌兰察布,凉城县厂汉营中学
内蒙古,乌兰察布,凉城县永兴镇永兴中学
内蒙古,乌兰察布,凉城县程家营中学
内蒙古,乌兰察布,察右前旗固尔班中学
内蒙古,乌兰察布,凉城县后营乡中学
内蒙古,乌兰察布,察右前旗平地泉中学
内蒙古,乌兰察布,内蒙古化德县德包图乡中学
内蒙古,乌兰察布,四子王旗供济堂中学
内蒙古,乌兰察布,察右后旗民族中学
内蒙古,乌兰察布,商都县小海子镇中学
内蒙古,乌兰察布,察右前旗第三中学
内蒙古,乌兰察布,察右后旗第三中学
内蒙古,乌兰察布,内蒙古化德县公腊胡洞乡学区
内蒙古,乌兰察布,四子王旗大黑河中学
内蒙古,乌兰察布,黑圪塔洼中学
内蒙古,乌兰察布,凉城县崞县夭学区
内蒙古,乌兰察布,丰镇市第六中学
内蒙古,乌兰察布,商都县十八顷镇中学
内蒙古,乌兰察布,内蒙古化德县朝阳镇学区
内蒙古,乌兰察布,察右前旗第二中学
内蒙古,乌兰察布,内蒙古化德县六十顷乡中学
内蒙古,乌兰察布,兴和县钦宝营学区
内蒙古,乌兰察布,凉城县麦胡图镇中学
内蒙古,乌兰察布,内蒙古化德县七号镇中学
内蒙古,乌兰察布,商都县大黑沙土镇中学
内蒙古,乌兰察布,商都县西井子镇中学
内蒙古,乌兰察布,丰镇市新营子中学
内蒙古,乌兰察布,察右前旗黄家村学校
内蒙古,乌兰察布,凉城县六苏木中学
内蒙古,乌兰察布,商都县小海子镇高勿素中学
内蒙古,乌兰察布,内蒙古察右中旗第四中学
内蒙古,乌兰察布,内蒙古化德县朝阳镇土城子中学
内蒙古,乌兰察布,四子王旗二中
内蒙古,乌兰察布,凉城县三苏木乡中学
内蒙古,乌兰察布,四子王旗东八号乡东八号中学
内蒙古,乌兰察布,察右前旗黄茂营中学
内蒙古,乌兰察布,商都县格化司台乡中学
内蒙古,乌兰察布,吉生太乡吉生太中学
内蒙古,乌兰察布,商都县大库伦乡中学
内蒙古,乌兰察布,商都县卯都乡中学
内蒙古,乌兰察布,石湾子中学
内蒙古,乌兰察布,察右前旗呼和乌素中心校
内蒙古,乌兰察布,四子王旗库伦图乡朝克文都中学
内蒙古,乌兰察布,四子王旗西河子中学
内蒙古,乌兰察布,察右后旗利民学校
内蒙古,乌兰察布,四子王旗活福滩中学
内蒙古,乌兰察布,商都县屯垦队镇中学
内蒙古,乌兰察布,商都县屯垦队镇二道洼中学
内蒙古,乌兰察布,察右前旗三号地乡中学
内蒙古,乌兰察布,四子王旗库伦图中学
内蒙古,乌兰察布,四子王旗供济堂乡吉庆中学
内蒙古,乌兰察布,察右后旗杰源学校
内蒙古,乌兰察布,四子王旗库伦图乡三元井中学
内蒙古,乌兰察布,四子王旗活福滩乡教委
内蒙古,乌兰察布,四子王旗大黑河乡太平庄中学
内蒙古,巴彦淖尔,五原县第三中学
内蒙古,巴彦淖尔,临河区第一中学
内蒙古,巴彦淖尔,临河区旭日中学
内蒙古,巴彦淖尔,临河区第三中学
内蒙古,巴彦淖尔,杭锦后旗奋斗中学
内蒙古,巴彦淖尔,巴彦淖尔市第二中学
内蒙古,巴彦淖尔,乌中旗蒙古族中学
内蒙古,巴彦淖尔,巴彦淖尔市中学
内蒙古,巴彦淖尔,乌拉特前旗蒙古族中学
内蒙古,巴彦淖尔,五原县第一中学
内蒙古,巴彦淖尔,内蒙古临河市第一中学
内蒙古,巴彦淖尔,巴彦淖尔市实验中学
内蒙古,巴彦淖尔,内蒙古巴盟励业中学
内蒙古,巴彦淖尔,临河区励业学校
内蒙古,巴彦淖尔,杭锦后旗陕坝中学
内蒙古,巴彦淖尔,磴口县第一完全中学
内蒙古,巴彦淖尔,临河市开发区中学
内蒙古,巴彦淖尔,呼和浩特铁路局临河职工子弟中学
内蒙古,巴彦淖尔,巴彦淖尔市蒙古族中学
内蒙古,巴彦淖尔,临河市古城镇中学
内蒙古,巴彦淖尔,乌拉特中旗第一中学
内蒙古,巴彦淖尔,乌拉特前旗第一中学
内蒙古,巴彦淖尔,临河市旭日中学
内蒙古,巴彦淖尔,河套大学附属实验中学
内蒙古,巴彦淖尔,巴彦淖尔市河套大学附属实验中学
内蒙古,巴彦淖尔,乌拉特后旗蒙古族中学
内蒙古,巴彦淖尔,杭锦后旗红星乡中学
内蒙古,巴彦淖尔,乌拉特后旗第一中学
内蒙古,巴彦淖尔,乌拉特前旗第五中学
内蒙古,巴彦淖尔,临河市第三中学
内蒙古,巴彦淖尔,乌中旗一中
内蒙古,巴彦淖尔,临河市城关中学
内蒙古,巴彦淖尔,磴口县第四完全中学
内蒙古,巴彦淖尔,五原县第七中学
内蒙古,巴彦淖尔,临河市第八中学
内蒙古,巴彦淖尔,巴彦淖尔盟蒙古族中学
内蒙古,巴彦淖尔,临河市第六中学
内蒙古,巴彦淖尔,临河市第二中学
内蒙古,巴彦淖尔,五原县同德中学
内蒙古,巴彦淖尔,临河市第四中学
内蒙古,巴彦淖尔,乌拉特中旗宏丰中学
内蒙古,巴彦淖尔,乌拉特前旗旭日中学
内蒙古,巴彦淖尔,巴盟新世纪学校
内蒙古,巴彦淖尔,巴盟桃李中学
内蒙古,巴彦淖尔,杭锦后旗发展中学
内蒙古,巴彦淖尔,巴盟才源中学
内蒙古,巴彦淖尔,临河市第九中学
内蒙古,巴彦淖尔,杭锦后旗蒙古族中学
内蒙古,巴彦淖尔,巴盟国营中滩农场中心学校
内蒙古,巴彦淖尔,临河市乌兰图克中学
内蒙古,巴彦淖尔,乌拉特中旗第二中学
内蒙古,巴彦淖尔,临河市第五中学
内蒙古,巴彦淖尔,临河市第七中学
内蒙古,巴彦淖尔,临河市丹达中学
内蒙古,巴彦淖尔,临河市八一乡中学
内蒙古,巴彦淖尔,乌拉特前旗大佘太镇中学
内蒙古,巴彦淖尔,杭锦后旗红旗乡中学
内蒙古,巴彦淖尔,巴彦淖尔盟国营乌兰布和农场子弟中学
内蒙古,巴彦淖尔,临河市新华镇中学
内蒙古,巴彦淖尔,五原县第二中学
内蒙古,巴彦淖尔,乌拉特前旗化肥厂中学
内蒙古,巴彦淖尔,乌拉特前旗先锋乡中学
内蒙古,巴彦淖尔,杭锦后旗太阳庙乡中学
内蒙古,巴彦淖尔,乌拉特前旗蒙一中
内蒙古,巴彦淖尔,杭锦后旗启智中学
内蒙古,巴彦淖尔,乌拉特后旗第二中学
内蒙古,巴彦淖尔,临河市中山学校
内蒙古,巴彦淖尔,临河市乌兰乡中学
内蒙古,巴彦淖尔,临河市黄羊中学
内蒙古,巴彦淖尔,巴彦淖尔盟中学
内蒙古,巴彦淖尔,五原县海子堰乡中学
内蒙古,巴彦淖尔,杭锦后旗联合乡中学
内蒙古,巴彦淖尔,临河市隆胜镇中学
内蒙古,巴彦淖尔,临河市开元中学
内蒙古,巴彦淖尔,杭锦后旗召庙乡中学
内蒙古,巴彦淖尔,乌拉特中旗德岭山中学
内蒙古,巴彦淖尔,磴口县第三完全中学
内蒙古,巴彦淖尔,临河市树人中学
内蒙古,巴彦淖尔,杭锦后旗头道桥镇中学
内蒙古,巴彦淖尔,内蒙古磴口县第六中学
内蒙古,巴彦淖尔,杭锦后旗查干乡中学
内蒙古,巴彦淖尔,乌拉特前旗北辰中学
内蒙古,巴彦淖尔,河套中学
内蒙古,巴彦淖尔,五原县第四中学
内蒙古,巴彦淖尔,乌拉特前旗立人中学
内蒙古,巴彦淖尔,乌拉特前旗公庙镇中学
内蒙古,巴彦淖尔,乌拉特中旗蒙古族中学
内蒙古,巴彦淖尔,磴口县第二完全中学
