北京,海淀区,北京一零一中学
河南,濮阳,清丰第三中学
河南,濮阳,濮阳市市区第九中学
河南,濮阳,范县辛庄乡一中
河南,濮阳,朗中三中
河南,濮阳,中原油田勘探局第二高级中学
河南,濮阳,鲁河三中
河南,濮阳,濮阳市职业中专
河南,濮阳,梁庄乡三中
河南,濮阳,双庙乡第二中学
河南,濮阳,郎中四中
河南,濮阳,文留镇六中
河南,濮阳,范县濮城镇一中
河南,濮阳,新习乡二中
河南,濮阳,濮阳市市区第四中学
河南,濮阳,海通乡二中
河南,濮阳,徐镇镇第一中学
河南,濮阳,南乐县杨村中学
河南,濮阳,濮阳市技工学校
河南,濮阳,新习乡三中
河南,濮阳,后方二中
河南,濮阳,王称固一中
河南,濮阳,濮阳市市区第七中学
河南,濮阳,濮阳市市区第三中学
河南,濮阳,柳屯镇二中
河南,濮阳,清河乡二中
河南,濮阳,濮阳市台前县第一中学
河南,濮阳,双庙乡教育组
河南,濮阳,濮阳市市区第十五中学
河南,濮阳,南乐县寺庄乡中学
河南,濮阳,清河头乡联合中学
河南,濮阳,胡状乡第二中学
河南,濮阳,范县颜村铺乡二中
河南,濮阳,清丰县巩营乡教育组
河南,濮阳,柳格乡教育组
河南,濮阳,韩村乡教育组
河南,濮阳,海通乡兴华中学
河南,濮阳,文留镇四中
河南,濮阳,清丰县仙庄乡教育组
河南,濮阳,濮阳市南乐县第一高级中学
河南,濮阳,白罡乡二中
河南,濮阳,郎中乡一中
河南,濮阳,双庙乡第一中学
河南,濮阳,郎中二中
河南,濮阳,王什乡教育组
河南,濮阳,海通乡一中
河南,濮阳,文留镇三中
河南,濮阳,濮阳县八公桥镇第二中学
河南,濮阳,胡状乡第三中
河南,濮阳,季家村民信中学
河南,濮阳,徐镇镇二中
河南,濮阳,打渔陈中学
河南,濮阳,南乐县元村镇二中
河南,濮阳,清丰县马庄桥镇教育组
河南,濮阳,户部寨乡中学
河南,濮阳,范县城关镇联校
河南,濮阳,南乐县张果屯乡中学
河南,濮阳,大屯乡教育组
河南,濮阳,庆祖镇第四中学
河南,濮阳,打渔陈三中
河南,濮阳,解庄中学
河南,濮阳,中原石油勘探局第四中学
河南,濮阳,濮阳曙光高级中学
河南,濮阳,夹河乡二中
河南,濮阳,文留镇五中
河南,濮阳,季家村育才中学
河南,濮阳,陈庄乡中学
河南,濮阳,杨集乡中学
河南,濮阳,清丰县大流乡教育组
河南,濮阳,清丰县城关镇教育组
河南,濮阳,清丰县阳邵乡教育组
河南,濮阳,梨元乡一中
河南,濮阳,中原石油勘探局第九中学
河南,濮阳,濮阳市市区第六中学
河南,濮阳,范县城关镇北杨铺中学
河南,濮阳,中原石油勘探局第十中学
河南,濮阳,庆祖镇第二中学
河南,濮阳,台前县侯庙乡第二中学
河南,濮阳,梁庄乡二中
河南,濮阳,濮阳市市区第十三中学
河南,濮阳,渠村乡二中
河南,濮阳,庆祖镇成人教育学校
河南,濮阳,中原石油勘探局第十二中学
河南,濮阳,濮阳市市区十一中学
河南,濮阳,濮阳市市区八中
河南,濮阳,两门中学
河南,濮阳,海通乡三中
河南,濮阳,玉安中学
河南,濮阳,中原石油勘探局第十九中学
河南,濮阳,清丰县六塔乡邵家文宛学校
河南,濮阳,梨元乡二中
河南,濮阳,中原石油勘探局第七中学
河南,濮阳,濮阳市市区第十二中学
河南,濮阳,子岸乡二中
河南,濮阳,梨元乡三中
河南,濮阳,中原石油勘探局第三中学
河南,濮阳,中原石油勘探局第三高级中学
河南,濮阳,庆祖镇一中学
河南,濮阳,南乐县寺庄乡第二中学
河南,濮阳,中原石油勘探局第二十中学
河南,濮阳,清丰县六塔乡教育组
河南,濮阳,濮阳市台前县城关镇联合中学
河南,濮阳,范县颜村铺乡中学
河南,濮阳,濮阳市台前县马楼乡中学
河南,濮阳,中原石油勘探局第十七中学
河南,濮阳,渠村乡三中
河南,濮阳,孟楼乡大屯中学
河南,濮阳,濮阳市市区第二中学
河南,濮阳,南乐县韩张镇实验中学
河南,濮阳,濮阳市台前县打渔陈乡联合中学
河南,濮阳,濮阳市市区岳村乡成教学校
河南,濮阳,中原石油勘探局第十八中学
河南,濮阳,子岸乡一中
河南,濮阳,中原石油勘探局第五中学
河南,濮阳,中原石油勘探局第十三中学
河南,濮阳,中原石油勘探局第一中学
河南,濮阳,中原石油勘探局第六中学
河南,濮阳,中原石油勘探局高级中学
河南,濮阳,中原石油勘探局第二十六中学
河南,濮阳,濮阳市市区胡村乡成人教育学校
河南,濮阳,南乐县福堪第二中学
河南,濮阳,濮阳市市区第十四中学
河南,焦作,沁阳市第一中学
河南,焦作,焦作市第一中学
河南,焦作,修武县第一中学
河南,焦作,沁阳市永威学校
河南,焦作,沁阳市永威中学
河南,焦作,武陟县武陟中学
河南,焦作,焦作市第十七中学
河南,焦作,焦作市第四中学
河南,焦作,博爱县第一中学
河南,焦作,河南省武陟县城关高中
河南,焦作,济源孟国平双语学校
河南,焦作,焦作市第十一中学
河南,焦作,博爱县许良镇泗沟学校
河南,焦作,焦作市第十五中学
河南,焦作,沁阳市覃怀办事处东关中学
河南,焦作,沁阳市综合高中
河南,焦作,焦作市十八中学
河南,焦作,河南省武陟县第一中学
河南,焦作,博爱县第四中学
河南,焦作,焦作希望实验学校
河南,焦作,河南省沁阳市宋学义中学
河南,焦作,修武县城关中学
河南,焦作,孟州市第一高级中学
河南,焦作,沁阳市第一中学分校
河南,焦作,博爱县清化镇联合中学
河南,焦作,沁阳市第五中学
河南,焦作,博爱县第二中学
河南,焦作,武陟县第一中学
河南,焦作,焦作市实验中学
河南,焦作,博爱县清化镇西关民族中学
河南,焦作,孟州市第五高级中学
河南,焦作,焦作市第二十三中学
河南,焦作,河南省武陟县大封高中
河南,焦作,博爱县高级中学
河南,焦作,焦作市第十二中学
河南,焦作,武陟县城关高中
河南,焦作,博爱县柏山镇联合中学
河南,焦作,沁阳市第四中学
河南,焦作,博爱县金城乡西金城学校
河南,焦作,沁阳市第三中学
河南,焦作,孟州市城关镇移民中学
河南,焦作,武陟县第一高中分校
河南,焦作,沁阳市西万镇联合中学
河南,焦作,温县第一高中分校
河南,焦作,博爱县磨头镇联合中学
河南,焦作,沁阳市王曲乡联合中学
河南,焦作,博爱县高庙乡中学
河南,焦作,焦作市山阳区第一中学
河南,焦作,孟州市第二高级中学
河南,焦作,博爱县月山镇联合中学
河南,焦作,月山铁路职工子弟中学
河南,焦作,博爱县界沟乡联合中学
河南,焦作,博爱县寨豁乡联合中学
河南,焦作,济源市第一中学
河南,焦作,焦作市中站区朱村乡教育办公室
河南,焦作,济源市高级中学
河南,焦作,沁阳市常平乡中心校中学部
河南,焦作,孟州市西虢镇联合中学
河南,焦作,孟州市第四高级中学
河南,焦作,济源市思礼乡联合中学
河南,焦作,磨头农场学校
河南,焦作,济源市轵城镇轵城二中
河南,焦作,博爱县第三中学
河南,焦作,焦作市艺术中学
河南,焦作,沁阳市山王庄镇联合中学
河南,焦作,沁阳市西向镇联合中学
河南,焦作,焦作市第二十七中学
河南,焦作,博爱县金城乡王保学校
河南,焦作,河南省焦作市第九中学
河南,焦作,沁阳市柏香镇联合中学
河南,焦作,沁阳市柏香镇联合中学
河南,焦作,温县第三高级中学
河南,焦作,河南省温县第四中学
河南,焦作,武陟县第二中学
河南,焦作,温县黄庄镇联合中学
河南,焦作,河南省孟州市职业中等专业学校
河南,焦作,河南省温县第六中学
河南,焦作,武陟县西陶镇一中
河南,焦作,武陟县第三中学
河南,焦作,博爱县高庙乡联合中学
河南,焦作,武陟县大虹桥乡联合中学
河南,焦作,修武县西村高级中学
河南,焦作,焦作市第六中学
河南,焦作,河南省孟州市实验中学
河南,焦作,武陟县西陶镇三中
河南,焦作,博爱县许良镇联合中学
河南,焦作,武陟县圪当店乡联合中学
河南,焦作,河南省焦作市第十三中学
河南,焦作,孟州市会昌办事处教育办公室中学
河南,焦作,沁阳市沁园办事处沁南中学
河南,焦作,沁阳市王召乡联合中学
河南,焦作,武陟县乔庙乡联合中学
河南,焦作,焦作东升双语实验学校
河南,焦作,焦作市第三中学
河南,焦作,河南省焦作市第七中学
河南,焦作,武陟县木城镇联合中学
河南,焦作,温县第六高级中学
河南,焦作,苏家作教办第二中学
河南,焦作,沁阳市紫陵镇赵寨中学
河南,焦作,济源市第五中学
河南,焦作,武陟县大封镇联合中学
河南,焦作,河南兴华机械制造厂兴华中学
河南,焦作,济源市轵城镇联合中学
河南,焦作,温县第四高级中学
河南,焦作,孟州市城关镇一中
河南,焦作,焦作宏昌学校
河南,焦作,高新区联合中学
河南,焦作,河南省孟州市第五高级中学
河南,焦作,沁阳市常平乡常平中学
河南,焦作,济源市邵原镇联合中学
河南,焦作,武陟县宁郭镇联合中学
河南,焦作,河南省温县第三中学
河南,焦作,孟州市城关镇教育办公室中学
河南,焦作,博爱县张茹集乡中学
河南,焦作,武陟县詹店镇联合中学
河南,焦作,济源市承留镇承留第一中学
河南,焦作,博爱县月山镇联中
河南,焦作,博爱县阳庙镇第二中学
河南,焦作,博爱县阳庙镇联合中学
河南,焦作,孟州市南庄镇第三中学
河南,焦作,河南省孟州市第一高级职业中学
河南,焦作,修武县五里源乡中心中学
河南,焦作,博爱县许良镇大辛庄回民中学
河南,焦作,沁阳市第六中学
河南,焦作,武陟县大封镇二中
河南,焦作,武陟县小董乡高村学校
河南,焦作,博爱县孝敬镇联合中学
河南,焦作,焦作市解放区第二十中学
河南,焦作,修武县第一中学分校
河南,焦作,济源市五龙口镇联合中学
河南,焦作,修武县方庄高级中学
河南,焦作,修武县高村高级中学
河南,焦作,武陟县第三高级中学
河南,焦作,沁阳市西向镇龙泉村龙泉中学
河南,焦作,焦作铁路职工子弟中学
河南,焦作,河南省孟州市第一高级中学
河南,焦作,孟州市第五高级中学分校
河南,焦作,博爱县苏家作乡联合中学
河南,焦作,修武县王屯乡付屯联中
河南,焦作,博爱县阳庙镇第三中学
河南,焦作,沁阳市怀庆办事处中心校沁北中学
河南,焦作,焦作市马村区安阳城乡李庄中学
河南,焦作,武陟县西陶镇联合中学
河南,焦作,武陟县谢旗营镇联合中学
河南,焦作,博爱县张茹集乡联合中学
河南,焦作,博爱县寨豁乡中学
河南,焦作,武陟县三阳乡联合中学
河南,焦作,沁阳市西向镇第二中学
河南,焦作,济源市梨林镇联合中学
河南,焦作,武陟县北郭乡联合中学
河南,焦作,沁阳中等职业学校
河南,焦作,沁阳市紫陵镇联合中学
河南,焦作,焦作市解放区第十九中学
河南,焦作,济源市下冶乡联合中学
河南,焦作,济源市克井镇联合中学
河南,焦作,武陟县小董乡渠下中心校
河南,焦作,修武县城关镇中心学校
河南,焦作,焦作市解放区王褚乡新庄学区士林学校
河南,焦作,武陟县阳城一中
河南,焦作,孟州市城伯镇北董中心学校
河南,焦作,博爱县苏家作乡第三中学
河南,焦作,孟州市谷旦镇三中
河南,焦作,武陟县小董乡北王中心校
河南,焦作,修武县葛庄乡第二中学
河南,焦作,修武县高村乡联合中学
河南,焦作,武陟县龙源镇联合中学
河南,焦作,武陟县第二高级中学
河南,焦作,孟州市槐树乡教育办公室中学
河南,焦作,温县南张羌乡联合中学
河南,焦作,武陟县圪当店乡三中
河南,焦作,孟州市化工镇教育办公室中学
河南,焦作,沁阳市常平乡山路平中学
河南,焦作,武陟县小董乡贾村中心校
河南,焦作,河南省孟州市第四高级中学
河南,焦作,博爱县阳庙镇第一中学
河南,焦作,济源市大峪镇联合中学
河南,焦作,高新区李万乡史平陵中学
河南,焦作,济源市大峪镇第一中学
河南,焦作,修武县方庄镇方庄第一中学
河南,焦作,焦作晨光学校
河南,焦作,武陟县大封镇三中
河南,焦作,温县第一高级中学
河南,焦作,孟州市谷旦镇长店中学
河南,焦作,焦作市马村区九里山乡中学
河南,焦作,济源市亚桥乡联合中学
河南,焦作,济源市天坛中学
河南,焦作,孟州市城伯镇城伯中心学校
河南,焦作,济源市梨林乡第一中学
河南,焦作,温县祥云镇联合中学
河南,焦作,济源市轵城镇轵城三中
河南,焦作,河南省孟州市第二高级中学
河南,焦作,武陟县大封镇四中
河南,焦作,孟州市赵和乡教育办公室联合中学
河南,焦作,孟州市南庄镇教育办公室中学
河南,焦作,焦作市中站区朱村中心学校
河南,焦作,温县徐堡镇中学
河南,焦作,武陟县阳城乡联合中学
河南,焦作,济源市亚桥乡亚桥一中
河南,焦作,博爱县金城乡联合中学
河南,焦作,沁阳市山王庄镇第一中学
河南,焦作,武陟县小董乡联合中学
河南,焦作,界沟第一中学
河南,焦作,武陟县西陶镇二中
河南,焦作,武陟县大虹桥乡第三中学
河南,焦作,济源市第二中学
河南,焦作,温县赵堡镇联合中学
河南,焦作,武陟县三阳乡二中
河南,焦作,博爱县苏家作乡第一中学
河南,焦作,孟州市南庄镇第一中学
河南,焦作,孟州市缑村镇梁村村中学
河南,焦作,济源市第四中学
河南,焦作,武陟县大虹桥乡第二中学
河南,焦作,焦作市中站区朱村乡中学五中
河南,焦作,焦作市马村区待王镇教育办公室中学
河南,焦作,武陟县詹店镇何井中学
河南,焦作,孟州市南庄镇第二中学
河南,焦作,沁阳市山王庄镇第二中学
河南,焦作,济源市王屋乡联合中学
河南,焦作,焦作市山阳区墙南中学
河南,焦作,焦作市马村区九里山乡教育办公室中学
河南,焦作,焦作市中站区小尚中心学校
河南,焦作,孟州市缑村镇水运村中学
河南,焦作,孟州市缑村镇上作村中学
河南,焦作,济源市第六中学
河南,焦作,修武县郇封镇中心学校
河南,焦作,武陟县詹店镇马营中学
河南,焦作,武陟县嘉应观乡联合中学
河南,焦作,济源市轵城镇轵城一中
河南,焦作,武陟县小董三中
河南,焦作,孟州市城伯镇教育办公室中学
河南,焦作,济源市中原特钢子弟高中
河南,焦作,焦作市中站区府城中心学校
河南,焦作,孟州市城伯镇立义中学
河南,焦作,济源市第三中学
河南,焦作,沁阳市西向镇第三中学
河南,焦作,孟州市缑村镇东韩村中学
河南,焦作,焦作市第八中学
河南,焦作,武陟县小董乡磨庄中心校
河南,焦作,武陟县圪当店乡四中
河南,焦作,焦作市解放区上白作乡中学
河南,焦作,温县杨垒乡第一中学
河南,焦作,武陟县西陶镇五中
河南,焦作,济源市下冶乡成人学校
河南,焦作,武陟县小董二中
河南,焦作,解放区王褚乡联合中学
河南,焦作,济源市大峪镇成人教育学校
河南,焦作,孟州市谷旦镇教育办公室中学
河南,焦作,焦作市解放区第二十二中学
河南,焦作,修武县岸上中学
河南,焦作,武陟县詹店镇占西中学
河南,焦作,焦作市马村区张弓中学
河南,焦作,温县招贤乡联合中学
河南,焦作,武陟县西陶镇四中
河南,焦作,温县武德镇乡第一中学
河南,焦作,孟州市缑村镇教育办公室中学
河南,焦作,焦作市马村区安阳城乡教育办公室中学
河南,焦作,武陟县大封镇五中
河南,焦作,温县温泉镇联合中学
河南,焦作,温县赵堡镇赵堡学校
河南,焦作,孟州市谷旦镇谷旦中学
河南,焦作,修武县方庄镇中心学校
河南,焦作,许良镇第一中学
河南,焦作,温县杨磊镇联合中学
河南,焦作,修武县西村乡中心中学
河南,焦作,焦作市中站区十四中
河南,焦作,武陟县圪当店乡二中
河南,焦作,焦作市马村区待王镇成人学校
河南,焦作,武陟县小董乡四中
河南,焦作,焦作市山阳区百间房乡中学
河南,焦作,修武县葛庄乡第一中学
河南,焦作,温县林肇乡中学
河南,焦作,修武县王屯乡中心学校
河南,焦作,武陟县嘉应观乡南贾中学
河南,焦作,温县南张羌乡一中
河南,焦作,焦作市山阳区恩村乡中学
河南,焦作,济源市思礼乡第二中学
河南,焦作,修武县葛庄乡中心学校
河南,焦作,武陟县大封镇六中
河南,焦作,温县南张羌乡二中
河南,焦作,温县黄庄镇第二中学
河南,焦作,济源市承留镇联合中学
河南,焦作,焦作市中站区回民学校
河南,焦作,温县黄庄镇第一中学
河南,新乡,新乡市第一中学
河南,新乡,长垣县二中
河南,新乡,长垣县十中
河南,新乡,河师大附中
河南,新乡,长垣县一中
河南,新乡,长垣县凯杰学校
河南,新乡,延津县第一高级中学
河南,新乡,新乡市第二中学
河南,新乡,河南省新乡县翟坡中学
河南,新乡,卫辉市第一中学
河南,新乡,新乡市第十一中学校
河南,新乡,长垣第十中学
河南,新乡,长垣县赵堤镇明亮中学
河南,新乡,原阳县天润中学
河南,新乡,河南省长垣县第一中学
河南,新乡,新乡市第三中学校
河南,新乡,第十二中学
河南,新乡,辉县市高级中学
河南,新乡,河南宏力学校
河南,新乡,新乡市第二十一中学
河南,新乡,新乡县一中
河南,新乡,新乡铁路高级中学
河南,新乡,原阳县第一中学
河南,新乡,新乡市第十二中学校
河南,新乡,原阳县城关镇阳光中学
河南,新乡,辉县市文昌高级中学
河南,新乡,新乡市培英学校
河南,新乡,新乡市第七中学校
河南,新乡,卫辉市高级中学
河南,新乡,河南省新乡县第一中学
河南,新乡,新乡市外国语学校
河南,新乡,新乡市第四中学
河南,新乡,河南省新乡县关堤中学
河南,新乡,新乡县龙泉中学
河南,新乡,原阳南街中学
河南,新乡,辉县市一中分校孟庄中学
河南,新乡,长垣县佘家乡武校
河南,新乡,新乡市第二十六中学校
河南,新乡,辉县市第一高级中学
河南,新乡,孟庄镇兴华中学
河南,新乡,原阳县实验中学
河南,新乡,获嘉县第一中学
河南,新乡,河南师范大学实验中学
河南,新乡,辉县市第二高级中学
河南,新乡,新乡市七中
河南,新乡,延津县一中
河南,新乡,长垣县凯杰中学
河南,新乡,新乡县龙泉高级中学
河南,新乡,新乡县翟坡中学
河南,新乡,河南省新乡县大召营中学
河南,新乡,新乡县古固寨镇联合中学
河南,新乡,封丘县高级中学
河南,新乡,辉县市一中分校
河南,新乡,河南省新乡市新乡县合河中学
河南,新乡,延津县第三高级中学
河南,新乡,长垣县武邱乡联合中学
河南,新乡,新乡市师专附属莘园学校
河南,新乡,封丘县实新学校
河南,新乡,封丘县第三高级中学
河南,新乡,长垣县丁栾镇联合中学
河南,新乡,长垣县满村乡联合中学
河南,新乡,河南省长垣县第二中学
河南,新乡,长垣县武术学校
河南,新乡,河南省新乡县朗公庙中学
河南,新乡,辉县市第四高级中学
河南,新乡,封丘县第一高级中学
河南,新乡,第二十一中学
河南,新乡,师寨三中
河南,新乡,新乡县小冀镇联合中学
河南,新乡,辉县市吴村镇联合中学
河南,新乡,新乡市第二十二中学
河南,新乡,原阳县第二中学
河南,新乡,封丘县黄德镇联合中学
河南,新乡,原阳四中
河南,新乡,长垣县总管乡联合中学
河南,新乡,新乡铁路职工子弟中学
河南,新乡,长垣县育才高中
河南,新乡,长垣县方里乡联合中学
河南,新乡,封丘县城关乡联合中学
河南,新乡,长垣县芦岗乡五中
河南,新乡,封丘县曹岗乡联合中学
河南,新乡,荆宫乡中心中学
河南,新乡,新乡县七里营中学
河南,新乡,长垣县赵堤乡联合中学
河南,新乡,原阳县第三高级中学
河南,新乡,辉县市第三高级中学
河南,新乡,实验高中
河南,新乡,河南省新乡县大块中学
河南,新乡,河南省封丘县第一中学
河南,新乡,桥北乡二中
河南,新乡,新乡市第一中学分校
河南,新乡,新乡县洪门镇联合中学
河南,新乡,封丘县王村乡联合中学
河南,新乡,获嘉县亢村学区中学
河南,新乡,新乡县合河乡联合中学
河南,新乡,新乡县朗公庙镇联合中学
河南,新乡,赵堤镇明亮中学
河南,新乡,河南省新乡县七里营中学
河南,新乡,新乡县小冀镇中街中学
河南,新乡,新乡县关堤乡联合中学
河南,新乡,封丘高级中学
河南,新乡,新乡县一中分校
河南,新乡,新乡市第五中学
河南,新乡,新乡市华光高级中学
河南,新乡,获嘉县太山乡第二初级中学
河南,新乡,封丘县第一中学分校
河南,新乡,辉县市第六高级中学
河南,新乡,蒋庄联合中学
河南,新乡,郭庄乡联合中学
河南,新乡,新乡市第十一中学分校
河南,新乡,封丘县陈桥乡联合中学
河南,新乡,王杏兰联合中学
河南,新乡,新乡一师附属中学
河南,新乡,封丘县油坊乡联合中学
河南,新乡,原阳县第四高级中学
河南,新乡,河南省新乡县大块镇联合中学
河南,新乡,长垣县六中
河南,新乡,长垣县满村乡第四中学
河南,新乡,获嘉县丁村乡中学管理区
河南,新乡,新乡市第三中学分校
河南,新乡,中和镇大官庄学校
河南,新乡,长垣县育才学校
河南,新乡,长垣县苗占乡联合中学
河南,新乡,原阳天润中学
河南,新乡,师寨镇二中
河南,新乡,保华学校
河南,新乡,孟庄镇郑屯中学
河南,新乡,桥北联合中学
河南,新乡,河南省新乡县大块镇第三中学
河南,新乡,冯庄镇第四中学
河南,新乡,新乡市黄岗普通学校
河南,新乡,师寨镇联合中学
河南,新乡,路寨乡联合中学
河南,新乡,第八中学
河南,新乡,陡门乡联合中学
河南,新乡,包厂乡联合中学
河南,新乡,大新庄乡实验中学
河南,新乡,第十三中学
河南,新乡,辉县市北云门乡联合中学
河南,新乡,新乡市第十中学
河南,新乡,黑羊山联合中学
河南,新乡,封丘县第二高级中学
河南,新乡,河南省新乡市第三十中学
河南,新乡,延津县王楼乡联合中学
河南,新乡,梁寨乡联合中学
河南,新乡,获嘉县第二中学
河南,新乡,新乡县七里营镇联合中学
河南,新乡,河南省长垣县第三中学
河南,新乡,应举乡应举中学
河南,新乡,福宁集乡联合中学
河南,新乡,长垣县位庄乡教育办公室
河南,新乡,延津县位邱乡联合中学
河南,新乡,照镜镇第四中学
河南,新乡,新乡铁路高级中学分校
河南,新乡,河南省长垣县新世纪中学
河南,新乡,齐街乡联合中学
河南,新乡,长垣县佘家乡豫新学校
河南,新乡,延津县塔铺乡联合中学
河南,新乡,封丘县孙庄乡联合中学
河南,新乡,封丘县陈固乡联合中学
河南,新乡,福宁集乡二中
河南,新乡,封丘县冯村乡希哲中学
河南,新乡,靳堂乡联合中学
河南,新乡,新乡市新谊中学
河南,新乡,恼里镇三中
河南,新乡,延津县胙城乡联合中学
河南,新乡,辉县市孟庄镇联合中学
河南,新乡,河南省新乡市第一中学
河南,新乡,卫辉市第二中学
河南,新乡,辉县市占城镇联合中学
河南,新乡,王村乡宜昌中学
河南,新乡,长垣县新世纪高级中学
河南,新乡,长垣县凡相镇联合中学
河南,新乡,新乡县小冀镇东街中学
河南,新乡,娄堤乡第一中学
河南,新乡,新乡县朗公庙中学
河南,新乡,获嘉县史庄镇吴庄学校
河南,新乡,延津县城关镇西街学校
河南,新乡,北云门镇姬家塞中学
河南,新乡,新乡市第二中学分校
河南,新乡,封丘县娄堤乡联合中学
河南,新乡,辉县市教师进修学校高中部
河南,新乡,原阳县电业局阳光中学
河南,新乡,大宾乡联合中学
河南,新乡,辉县市三郊口乡联合中学
河南,新乡,封丘县獐鹿市乡联合中学
河南,新乡,城关镇大西关中学
河南,新乡,齐街乡一中
河南,新乡,长垣县芦岗乡教办室
河南,新乡,新乡市第九中学校
河南,新乡,长垣县佘家乡联合中学
河南,新乡,新乡县小冀镇西街中学
河南,新乡,中和镇实验中学
河南,新乡,河南省原阳县希望中学
河南,新乡,长垣县城关镇联合中学
河南,新乡,获嘉县冯庄镇冯庄中学
河南,新乡,延津县司寨乡联合中学
河南,新乡,官厂乡联合中学
河南,新乡,新乡县合河中学
河南,新乡,辉县市张村乡联合中学
河南,新乡,卫辉市第三中学
河南,新乡,辉县市黄水乡联合中学
